"[<p style=""font-size:1.2em"">Zindua your career in <strong>Software Engineering</strong>, <strong>Data Science</strong>, and other emerging tech careers. Worried about financing? <strong>Lipa mdogo mdogo</strong> or defer <strong>50% of fees into an income-share agreement</strong>.</p>, <p class=""has-text-align-center"" style=""font-size:1.1em"">Not just a coding school! We model our programs towards top tech certifications by <strong>Amazon Web Services</strong> and <strong>Microsoft Azure</strong></p>, <p style=""font-size:1em"">Learn all the fundamentals of programming, data analysis, data visualisation, machine learning, and big data engineering with <strong>Python</strong> and <strong>SQL</strong> in 25 weeks.</p>, <p style=""font-size:1em"">Learn all the fundamentals of programming, frontend web dev, backend web dev, and systems engineering with <strong>Python &amp; Django</strong> and <strong>JavaScript &amp; React</strong> in 25 weeks.</p>, <p style=""font-size:1em"">Learn all the fundamentals of programming, frontend web dev, backend web dev, and systems engineering with <strong>JavaScript</strong>, <strong>React.JS</strong>, and <strong>Node.JS</strong> in 4 months.</p>, <p class=""has-text-align-center"" style=""font-size:1.1em"">Below are some of our featured testimonials. See all our reviews on <a href=""https://www.google.com/search?q=zindua+school+google+reviews&amp;oq=zindua+school+google+reviews&amp;aqs=chrome..69i57.5528j0j1&amp;sourceid=chrome&amp;ie=UTF-8#"" rel=""noreferrer noopener"" target=""_blank"">Google Reviews</a> and <a href=""https://www.coursereport.com/schools/zindua-school"" rel=""noreferrer noopener"" target=""_blank"">Course Report</a></p>, <p class=""kt-adv-heading519_1d1f60-54 wp-block-kadence-advancedheading"" data-kb-block=""kb-adv-heading519_1d1f60-54"">We welcome <strong>new cohorts every 5 weeks</strong> – your gateway into a  future in tech starts NOW!</p>, <p>+254 (0) 768 342776 | <a class=""__cf_email__"" data-cfemail=""0e666b6262614e7467606a7b6f7d6d66616162206d6163"" href=""/cdn-cgi/l/email-protection"">[email protected]</a> | 233 Owashika Road, Lavington, Nairobi</p>, <p>© 2024 Zindua Coding School LTD</p>]"
"Zindua your career in Software Engineering, Data Science, and other emerging tech careers. Worried about financing? Lipa mdogo mdogo or defer 50% of fees into an income-share agreement."
Not just a coding school! We model our programs towards top tech certifications by Amazon Web Services and Microsoft Azure
"Learn all the fundamentals of programming, data analysis, data visualisation, machine learning, and big data engineering with Python and SQL in 25 weeks."
"Learn all the fundamentals of programming, frontend web dev, backend web dev, and systems engineering with Python & Django and JavaScript & React in 25 weeks."
"Learn all the fundamentals of programming, frontend web dev, backend web dev, and systems engineering with JavaScript, React.JS, and Node.JS in 4 months."
Below are some of our featured testimonials. See all our reviews on Google Reviews and Course Report
We welcome new cohorts every 5 weeks – your gateway into a  future in tech starts NOW!
"+254 (0) 768 342776 | [email protected] | 233 Owashika Road, Lavington, Nairobi"
© 2024 Zindua Coding School LTD
